{
  "adjudicatedOn": "2026-10-04",
  "adjudicator": "Adjudicator C",
  "items": [
    {
      "adjudicatedLabel": "truck",
      "overlap": {
        "label": "truck"
      },
      "primary": {
        "label": "truck"
      },
      "processingRunId": "00000000-0000-0000-0000-000000001000",
      "resolution": "carried",
      "trackId": "00000000-0000-4000-8000-000000000002"
    },
    {
      "adjudicatedLabel": "unknown",
      "adjudicatedUnknownReason": "too-small",
      "overlap": {
        "label": "unknown",
        "unknownReason": "too-small"
      },
      "primary": {
        "label": "car"
      },
      "processingRunId": "00000000-0000-0000-0000-000000001000",
      "resolution": "adjudicated",
      "trackId": "00000000-0000-4000-8000-000000000004"
    },
    {
      "adjudicatedLabel": "motorcycle",
      "overlap": {
        "label": "motorcycle"
      },
      "primary": {
        "label": "motorcycle"
      },
      "processingRunId": "00000000-0000-0000-0000-000000001001",
      "resolution": "carried",
      "trackId": "00000000-0000-4000-8000-000000000022"
    }
  ],
  "overlapLabelsSha256": "9403204537e23acfe9b4e29ec45d294ca59dfbe7cb8d7cca1320c95230012ca2",
  "primaryLabelsSha256": "124164bde5a79d2b612cf13f343182076566d1412a79b929dea3e2ab7fd629ea",
  "schemaVersion": "vehicle-subclass-adjudication-v1",
  "vocabulary": "mavi-vehicle-subclass-labels-v1"
}
